{
  "schema_version": "0.2",
  "anchor_id": "room",
  "objects": [
    {
      "id": "room",
      "prototype": "regular_octagon_boundary",
      "params": {
        "span_flat_to_flat_in": 167,
        "origin": [
          0,
          0
        ],
        "north_wall_normal": [
          0,
          1
        ],
        "wall_height_in": 13.75
      },
      "style": {
        "color": [
          0.8,
          0.8,
          0.8,
          0.15
        ]
      }
    },
    {
      "id": "block",
      "prototype": "poly_extrude",
      "params": {
        "footprint": [
          [
            -10,
            -10
          ],
          [
            10,
            -10
          ],
          [
            10,
            10
          ],
          [
            -10,
            10
          ]
        ],
        "extrusion": {
          "z_base": 0,
          "height": 4
        }
      },
      "style": {
        "color": [
          0,
          0,
          1,
          1
        ]
      }
    }
  ],
  "operators": [
    {
      "op": "clip_to_object",
      "target_ids": [
        "block"
      ],
      "clip_object_id": "room"
    }
  ]
}